,wind_code,sec_name,ar_by_buyer_name,ar_buyer_standard,ar_buyer_subid,cus_name,cus_name_standard,cus_name_subid,ar_buyer_region,cus_region,match_score
308554,300081.SZ,恒信东方,中国移动通信集团河北有限公司山东移动分公司,中国移动通信集团河北有限公司山东移动分公司,9,中国移动通信集团河北有限公司,中国移动通信集团河北有限公司,5,河北,河北,100
308581,300081.SZ,恒信东方,中国移动通信集团河北有限公司承德分公司,中国移动通信集团河北有限公司承德分公司,10,中国移动通信集团河北有限公司,中国移动通信集团河北有限公司,5,河北,河北,100
308582,300081.SZ,恒信东方,中国移动通信集团河北有限公司承德分公司,中国移动通信集团河北有限公司承德分公司,10,中国移动通信集团河北有限公司承德分公司,中国移动通信集团河北有限公司承德分公司,6,河北,河北,100
308583,300081.SZ,恒信东方,中国移动通信集团河北有限公司承德分公司,中国移动通信集团河北有限公司承德分公司,10,中国移动通信集团河北有限公司邢台分公司,中国移动通信集团河北有限公司邢台分公司,7,河北,河北,89
308584,300081.SZ,恒信东方,中国移动通信集团河北有限公司承德分公司,中国移动通信集团河北有限公司承德分公司,10,中国移动通信集团河北有限公司邯郸分公司,中国移动通信集团河北有限公司邯郸分公司,8,河北,河北,89
308608,300081.SZ,恒信东方,中国移动通信集团河北有限公司沧州分公司,中国移动通信集团河北有限公司沧州分公司,11,中国移动通信集团河北有限公司,中国移动通信集团河北有限公司,5,河北,河北,100
308609,300081.SZ,恒信东方,中国移动通信集团河北有限公司沧州分公司,中国移动通信集团河北有限公司沧州分公司,11,中国移动通信集团河北有限公司承德分公司,中国移动通信集团河北有限公司承德分公司,6,河北,河北,89
308610,300081.SZ,恒信东方,中国移动通信集团河北有限公司沧州分公司,中国移动通信集团河北有限公司沧州分公司,11,中国移动通信集团河北有限公司邢台分公司,中国移动通信集团河北有限公司邢台分公司,7,河北,河北,89
308611,300081.SZ,恒信东方,中国移动通信集团河北有限公司沧州分公司,中国移动通信集团河北有限公司沧州分公司,11,中国移动通信集团河北有限公司邯郸分公司,中国移动通信集团河北有限公司邯郸分公司,8,河北,河北,89
308635,300081.SZ,恒信东方,中国移动通信集团河北有限公司石家庄分公司,中国移动通信集团河北有限公司石家庄分公司,12,中国移动通信集团河北有限公司,中国移动通信集团河北有限公司,5,河北,河北,100
308662,300081.SZ,恒信东方,中国移动通信集团河北有限公司秦皇岛分公司,中国移动通信集团河北有限公司秦皇岛分公司,13,中国移动通信集团河北有限公司,中国移动通信集团河北有限公司,5,河北,河北,100
308689,300081.SZ,恒信东方,中国移动通信集团河北有限公司衡水分公司,中国移动通信集团河北有限公司衡水分公司,14,中国移动通信集团河北有限公司,中国移动通信集团河北有限公司,5,河北,河北,100
308690,300081.SZ,恒信东方,中国移动通信集团河北有限公司衡水分公司,中国移动通信集团河北有限公司衡水分公司,14,中国移动通信集团河北有限公司承德分公司,中国移动通信集团河北有限公司承德分公司,6,河北,河北,89
308691,300081.SZ,恒信东方,中国移动通信集团河北有限公司衡水分公司,中国移动通信集团河北有限公司衡水分公司,14,中国移动通信集团河北有限公司邢台分公司,中国移动通信集团河北有限公司邢台分公司,7,河北,河北,89
308692,300081.SZ,恒信东方,中国移动通信集团河北有限公司衡水分公司,中国移动通信集团河北有限公司衡水分公司,14,中国移动通信集团河北有限公司邯郸分公司,中国移动通信集团河北有限公司邯郸分公司,8,河北,河北,89
308716,300081.SZ,恒信东方,中国移动通信集团河北有限公司邢台分公司,中国移动通信集团河北有限公司邢台分公司,15,中国移动通信集团河北有限公司,中国移动通信集团河北有限公司,5,河北,河北,100
308717,300081.SZ,恒信东方,中国移动通信集团河北有限公司邢台分公司,中国移动通信集团河北有限公司邢台分公司,15,中国移动通信集团河北有限公司承德分公司,中国移动通信集团河北有限公司承德分公司,6,河北,河北,89
308718,300081.SZ,恒信东方,中国移动通信集团河北有限公司邢台分公司,中国移动通信集团河北有限公司邢台分公司,15,中国移动通信集团河北有限公司邢台分公司,中国移动通信集团河北有限公司邢台分公司,7,河北,河北,100
308719,300081.SZ,恒信东方,中国移动通信集团河北有限公司邢台分公司,中国移动通信集团河北有限公司邢台分公司,15,中国移动通信集团河北有限公司邯郸分公司,中国移动通信集团河北有限公司邯郸分公司,8,河北,河北,89
308911,300081.SZ,恒信东方,北京昌平科技发展有限公司,北京昌平科技发展有限公司,22,北京昌平科技园发展有限公司,北京昌平科技园发展有限公司,11,北京,北京,92
308938,300081.SZ,恒信东方,北京昌平科技园发展有限公司,北京昌平科技园发展有限公司,23,北京昌平科技园发展有限公司,北京昌平科技园发展有限公司,11,北京,北京,100
308966,300081.SZ,恒信东方,北京易橙天下科技有限公司,北京易橙天下科技有限公司,24,北京易橙天下科技有限公司,北京易橙天下科技有限公司,12,北京,北京,100
308994,300081.SZ,恒信东方,北京爱农天地农业有限公司,北京爱农天地农业有限公司,25,北京爱农天地农业有限公司,北京爱农天地农业有限公司,13,北京,北京,100
309022,300081.SZ,恒信东方,北京龙步视觉文化产业有限公司,北京龙步视觉文化产业有限公司,26,北京龙步视觉文化产业有限公司,北京龙步视觉文化产业有限公司,14,北京,北京,100
309269,300081.SZ,恒信东方,广州市卓志物流服务有限公司,广州市卓志物流服务有限公司,35,广州市卓志物流服务有限公司,广州市卓志物流服务有限公司,18,广州,广州,100
309408,300081.SZ,恒信东方,江苏赛博华宇科技有限公司,江苏赛博华宇科技有限公司,40,江苏赛博宇华科技有限公司,江苏赛博宇华科技有限公司,22,江苏,江苏,92
309544,300081.SZ,恒信东方,湖北夺宝奇兵影视文化有限公司,湖北夺宝奇兵影视文化有限公司,45,湖北夺宝奇兵影视文化有限公司,湖北夺宝奇兵影视文化有限公司,23,湖北,湖北,100
309714,300083.SZ,创世纪,东莞市欧珀精密电子有限公司,东莞市欧珀精密电子有限公司,7,东莞市欧珀精密电子有限公司,东莞市欧珀精密电子有限公司,1,东莞,东莞,100
309771,300083.SZ,创世纪,惠州三星电子有限公司,惠州三星电子有限公司,18,惠州三星电子有限公司,惠州三星电子有限公司,3,惠州,惠州,100
309817,300083.SZ,创世纪,深圳市中兴康讯电子有限公司,深圳市中兴康讯电子有限公司,27,深圳市中兴康讯电子有限公司,深圳市中兴康讯电子有限公司,4,深圳,深圳,100
310139,300086.SZ,康芝药业,国药控股广州有限公司,国药控股广州有限公司,12,国药控股广州有限公司,国药控股广州有限公司,1,广州,广州,100
310209,300086.SZ,康芝药业,广州医药有限公司,广州医药有限公司,26,国药控股广州有限公司,国药控股广州有限公司,1,广州,广州,86
310221,300086.SZ,康芝药业,广州国盈医药有限公司,广州国盈医药有限公司,28,广州国盈医药有限公司,广州国盈医药有限公司,3,广州,广州,100
310252,300086.SZ,康芝药业,江苏省医药有限公司,江苏省医药有限公司,34,江苏省医药有限公司,江苏省医药有限公司,4,江苏,江苏,100
310343,300086.SZ,康芝药业,陕西天舒医药有限公司,陕西天舒医药有限公司,52,陕西天舒医药有限公司,陕西天舒医药有限公司,5,陕西,陕西,100
310372,300088.SZ,长信科技,合肥京东方光电科技有限公司,合肥京东方光电科技有限公司,5,合肥京东方光电科技有限公司,合肥京东方光电科技有限公司,4,合肥,合肥,100
310504,300091.SZ,金通灵,上海神农节能环保科技股份有限公司,上海神农节能环保科技股份有限公司,4,上海神农节能环保科技股份有限公司,上海神农节能环保科技股份有限公司,1,上海,上海,100
310525,300091.SZ,金通灵,上海运能能源科技有限公司,上海运能能源科技有限公司,5,上海运能能源科技有限公司,上海运能能源科技有限公司,2,上海,上海,100
311035,300091.SZ,金通灵,山西高义钢铁有限公司,山西高义钢铁有限公司,30,山西高义钢铁有限公司,山西高义钢铁有限公司,12,山西,山西,100
311159,300091.SZ,金通灵,河北槐阳生物质热电有限责任公司,河北槐阳生物质热电有限责任公司,36,河北槐阳生物质热电有限责任公司,河北槐阳生物质热电有限责任公司,16,河北,河北,100
311262,300091.SZ,金通灵,陕西略阳钢铁有限责任公司,陕西略阳钢铁有限责任公司,41,陕西略阳钢铁有限责任公司,陕西略阳钢铁有限责任公司,19,陕西,陕西,100
311270,300092.SZ,科新机电,东方电机控制设备有限公司,东方电机控制设备有限公司,2,东方电机控制设备有限公司,东方电机控制设备有限公司,2,东方,东方,100
311446,300095.SZ,华伍股份,上海振华港机重工有限公司,上海振华港机重工有限公司,2,上海振华港机重工有限公司,上海振华港机重工有限公司,2,上海,上海,100
311463,300095.SZ,华伍股份,上海振华重工(集团)股份有限公司,上海振华重工(集团)股份有限公司,3,上海振华重工(集团)股份有限公司,上海振华重工(集团)股份有限公司,3,上海,上海,100
311497,300095.SZ,华伍股份,东方电气风电股份有限公司,东方电气风电股份有限公司,5,东方电气风电股份有限公司,东方电气风电股份有限公司,5,东方,东方,100
311661,300095.SZ,华伍股份,广东明阳新能源科技有限公司,广东明阳新能源科技有限公司,15,广东明阳新能源科技有限公司,广东明阳新能源科技有限公司,9,广东,广东,100
311776,300095.SZ,华伍股份,江苏金风科技有限公司,江苏金风科技有限公司,22,江苏金风科技有限公司,江苏金风科技有限公司,12,江苏,江苏,100
311909,300096.SZ,ST易联众,三明市人力资源和社会保障局,三明市人力资源和社会保障局,1,三明市人力资源和社会保障局,三明市人力资源和社会保障局,1,三明,三明,100
312000,300096.SZ,ST易联众,中国农业银行股份有限公司山西省分行,中国农业银行股份有限公司山西省分行,5,中国建设银行股份有限公司山西省分行,中国建设银行股份有限公司山西省分行,4,山西,山西,88
312065,300096.SZ,ST易联众,中国农业银行股份有限公司龙岩分行,中国农业银行股份有限公司龙岩分行,8,中国农业银行股份有限公司龙岩分行,中国农业银行股份有限公司龙岩分行,3,龙岩,龙岩,100
312157,300096.SZ,ST易联众,中国建设银行股份有限公司莆田分行,中国建设银行股份有限公司莆田分行,12,兴业银行股份有限公司莆田分行,兴业银行股份有限公司莆田分行,7,莆田,莆田,86
312383,300096.SZ,ST易联众,吉林大学第一医院,吉林大学第一医院,22,吉林大学第一医院,吉林大学第一医院,13,吉林,吉林,100
312628,300096.SZ,ST易联众,湖南省人力资源和社会保障厅,湖南省人力资源和社会保障厅,33,湖南省人力资源和社会保障厅,湖南省人力资源和社会保障厅,16,湖南,湖南,100
312783,300096.SZ,ST易联众,福建海峡银行股份有限公司,福建海峡银行股份有限公司,40,福建海峡银行股份有限公司,福建海峡银行股份有限公司,17,福建,福建,100
312895,300096.SZ,ST易联众,福建省星云大数据应用服务有限公司,福建省星云大数据应用服务有限公司,45,福建省星云大数据应用服务有限公司,福建省星云大数据应用服务有限公司,19,福建,福建,100
313033,300097.SZ,智云股份,东莞市德普特电子有限公司,东莞市德普特电子有限公司,4,东莞市德普特电子有限公司,东莞市德普特电子有限公司,2,东莞,东莞,100
313142,300097.SZ,智云股份,北汽福田汽车股份有限公司北京福田发动机厂,北汽福田汽车股份有限公司北京福田发动机厂,11,北汽福田汽车股份有限公司北京福田发动机厂,北汽福田汽车股份有限公司北京福田发动机厂,6,北京,北京,100
313158,300097.SZ,智云股份,合肥国轩高科动力能源股份公司,合肥国轩高科动力能源股份公司,12,合肥国轩高科动力能源股份公司,合肥国轩高科动力能源股份公司,7,合肥,合肥,100
313283,300097.SZ,智云股份,江西合力泰科技有限公司,江西合力泰科技有限公司,20,江西合力泰科技有限公司,江西合力泰科技有限公司,12,江西,江西,100
313315,300097.SZ,智云股份,深圳市四维自动化设备有限公司,深圳市四维自动化设备有限公司,22,深圳市四维自动化设备有限公司,深圳市四维自动化设备有限公司,14,深圳,深圳,100
313392,300099.SZ,尤洛卡,北京呈创科技股份有限公司,北京呈创科技股份有限公司,4,北京呈创科技股份有限公司,北京呈创科技股份有限公司,1,北京,北京,100
313403,300099.SZ,尤洛卡,北京普锐全球科技发展有限公司,北京普锐全球科技发展有限公司,6,北京普锐全球科技发展有限公司,北京普锐全球科技发展有限公司,2,北京,北京,100
313409,300099.SZ,尤洛卡,北京金瑞天衡电子设备有限公司,北京金瑞天衡电子设备有限公司,7,北京金瑞天衡电子设备有限公司,北京金瑞天衡电子设备有限公司,3,北京,北京,100
314328,300103.SZ,达刚控股,渭南高新技术产业开发区建设局,渭南高新技术产业开发区建设局,37,渭南高新技术产业开发区建设局,渭南高新技术产业开发区建设局,12,渭南,渭南,100
314393,300103.SZ,达刚控股,湖南正和通银业有限公司,湖南正和通银业有限公司,40,湖南正和通银业有限公司,湖南正和通银业有限公司,14,湖南,湖南,100
314458,300103.SZ,达刚控股,西安高科城市服务管理有限责任公司,西安高科城市服务管理有限责任公司,43,西安高科城市服务管理有限责任公司,西安高科城市服务管理有限责任公司,16,西安,西安,100
314619,300105.SZ,龙源技术,上海锅炉厂有限公司,上海锅炉厂有限公司,2,上海锅炉厂有限公司,上海锅炉厂有限公司,1,上海,上海,100
314711,300105.SZ,龙源技术,东营龙源清洁能源科技有限公司,东营龙源清洁能源科技有限公司,5,东营龙源清洁能源科技有限公司,东营龙源清洁能源科技有限公司,6,东营,东营,100
314746,300105.SZ,龙源技术,中国电建集团山东电力建设第一工程有限公司,中国电建集团山东电力建设第一工程有限公司,6,中国电建集团山东电力建设第一工程有限公司,中国电建集团山东电力建设第一工程有限公司,12,山东,山东,100
314957,300105.SZ,龙源技术,哈尔滨锅炉厂,哈尔滨锅炉厂,13,哈尔滨锅炉厂有限责任公司,哈尔滨锅炉厂有限责任公司,20,哈尔滨,哈尔滨,100
314986,300105.SZ,龙源技术,哈尔滨锅炉厂有限责任公司,哈尔滨锅炉厂有限责任公司,14,哈尔滨锅炉厂有限责任公司,哈尔滨锅炉厂有限责任公司,20,哈尔滨,哈尔滨,100
316494,300106.SZ,西部牧业,石河子市三盈牧业有限责任公司,石河子市三盈牧业有限责任公司,18,石河子市桃园牧业有限责任公司,石河子市桃园牧业有限责任公司,20,石河子,石河子,86
316523,300106.SZ,西部牧业,石河子市利群牧业有限责任公司,石河子市利群牧业有限责任公司,19,石河子市桃园牧业有限责任公司,石河子市桃园牧业有限责任公司,20,石河子,石河子,86
316552,300106.SZ,西部牧业,石河子市天盈牧业有限责任公司,石河子市天盈牧业有限责任公司,20,石河子市桃园牧业有限责任公司,石河子市桃园牧业有限责任公司,20,石河子,石河子,86
316581,300106.SZ,西部牧业,石河子市曙瑞牧业有限责任公司,石河子市曙瑞牧业有限责任公司,21,石河子市桃园牧业有限责任公司,石河子市桃园牧业有限责任公司,20,石河子,石河子,86
316610,300106.SZ,西部牧业,石河子市梦园牧业有限责任公司,石河子市梦园牧业有限责任公司,22,石河子市桃园牧业有限责任公司,石河子市桃园牧业有限责任公司,20,石河子,石河子,93
316640,300106.SZ,西部牧业,石河子市疆垦商贸有限公司,石河子市疆垦商贸有限公司,23,石河子市疆垦商贸有限公司,石河子市疆垦商贸有限公司,21,石河子,石河子,100
316700,300106.SZ,西部牧业,西牧乳业(上海)有限公司,西牧乳业(上海)有限公司,25,西牧乳业(上海)有限公司,西牧乳业(上海)有限公司,23,上海,上海,100
316969,300107.SZ,建新股份,德州虹桥染料化工有限公司,德州虹桥染料化工有限公司,47,德州虹桥染料化工有限公司,德州虹桥染料化工有限公司,4,德州,德州,100
316980,300107.SZ,建新股份,江苏好收成韦恩农化股份有限公司,江苏好收成韦恩农化股份有限公司,49,江苏好收成韦恩农化股份有限公司,江苏好收成韦恩农化股份有限公司,5,江苏,江苏,100
317009,300108.SZ,*ST吉药,东药集团吉林医药有限公司,东药集团吉林医药有限公司,1,东药集团吉林医药有限公司,东药集团吉林医药有限公司,4,吉林,吉林,100
317088,300108.SZ,*ST吉药,东莞新东方科技有限公司,东莞新东方科技有限公司,4,东莞新东方科技有限公司,东莞新东方科技有限公司,5,东莞,东莞,100
317115,300108.SZ,*ST吉药,云南泗环药业有限公司,云南泗环药业有限公司,5,云南泗环药业有限公司,云南泗环药业有限公司,6,云南,云南,100
317171,300108.SZ,*ST吉药,国药控股天和吉林医药有限公司,国药控股天和吉林医药有限公司,7,国药控股天和吉林医药有限公司,国药控股天和吉林医药有限公司,10,吉林,吉林,100
317304,300108.SZ,*ST吉药,山东华源天宏药业有限公司,山东华源天宏药业有限公司,12,山东华源天宏药业有限公司,山东华源天宏药业有限公司,13,山东,山东,100
317331,300108.SZ,*ST吉药,山东大洪药业有限公司,山东大洪药业有限公司,13,山东大洪药业有限公司,山东大洪药业有限公司,14,山东,山东,100
317360,300108.SZ,*ST吉药,广东弘联医药药材有限公司,广东弘联医药药材有限公司,14,广东弘联医药药材有限公司,广东弘联医药药材有限公司,17,广东,广东,100
317413,300108.SZ,*ST吉药,成都荷花池药业有限责任公司,成都荷花池药业有限责任公司,16,成都荷花池药业有限责任公司,成都荷花池药业有限责任公司,18,成都,成都,100
317518,300108.SZ,*ST吉药,沈阳卫世医药有限公司,沈阳卫世医药有限公司,20,沈阳卫世医药有限公司,沈阳卫世医药有限公司,19,沈阳,沈阳,100
317652,300108.SZ,*ST吉药,河南省瑞安医药有限公司,河南省瑞安医药有限公司,25,河南省瑞安医药有限公司,河南省瑞安医药有限公司,23,河南,河南,100
317783,300108.SZ,*ST吉药,立达乐仁(北京)医药有限公司(刘成锁),立达乐仁(北京)医药有限公司(刘成锁),30,立达乐仁(北京)医药有限公司,立达乐仁(北京)医药有限公司,24,北京,北京,100
317848,300110.SZ,华仁药业,大连维达医药有限公司,大连维达医药有限公司,5,大连维达医药有限公司,大连维达医药有限公司,1,大连,大连,100
317858,300110.SZ,华仁药业,安徽康明医药有限公司,安徽康明医药有限公司,6,安徽康明医药有限公司,安徽康明医药有限公司,2,安徽,安徽,100
317868,300110.SZ,华仁药业,山东瑞康医药股份有限公司,山东瑞康医药股份有限公司,7,山东瑞康医药股份有限公司,山东瑞康医药股份有限公司,3,山东,山东,100
317878,300110.SZ,华仁药业,广东大翔药业有限公司,广东大翔药业有限公司,8,广东大翔药业有限公司,广东大翔药业有限公司,4,广东,广东,100
317888,300110.SZ,华仁药业,武汉阳光医药有限公司,武汉阳光医药有限公司,9,武汉阳光医药有限公司,武汉阳光医药有限公司,5,武汉,武汉,100
317926,300110.SZ,华仁药业,辽宁万隆医药有限公司,辽宁万隆医药有限公司,13,辽宁万隆医药有限公司,辽宁万隆医药有限公司,7,辽宁,辽宁,100
318000,300110.SZ,华仁药业,黑龙江省禾润凯迪医药有限公司,黑龙江省禾润凯迪医药有限公司,21,黑龙江省禾润凯迪医药有限公司,黑龙江省禾润凯迪医药有限公司,9,黑龙江,黑龙江,100
318458,300117.SZ,*ST嘉寓,延安中新嘉特新能源发电有限责任公司,延安中新嘉特新能源发电有限责任公司,19,延安中新嘉特新能源发电有限责任公司,延安中新嘉特新能源发电有限责任公司,17,延安,延安,100
318483,300117.SZ,*ST嘉寓,延安能源光伏扶贫有限公司,延安能源光伏扶贫有限公司,20,延安能源光伏扶贫有限公司,延安能源光伏扶贫有限公司,18,延安,延安,100
319298,300123.SZ,亚光科技,深圳迅隆船务有限公司,深圳迅隆船务有限公司,46,深圳迅隆船务,深圳迅隆船务,8,深圳,深圳,100
319299,300123.SZ,亚光科技,深圳迅隆船务有限公司,深圳迅隆船务有限公司,46,深圳迅隆船务有限公司,深圳迅隆船务有限公司,9,深圳,深圳,100
319621,300133.SZ,华策影视,北京奇艺世纪科技有限公司,北京奇艺世纪科技有限公司,5,北京奇艺世纪科技有限公司,北京奇艺世纪科技有限公司,3,北京,北京,100
319707,300133.SZ,华策影视,浙江广播电视集团,浙江广播电视集团,12,浙江广播电视集团,浙江广播电视集团,5,浙江,浙江,100
319720,300133.SZ,华策影视,深圳市腾讯计算机系统有限公司,深圳市腾讯计算机系统有限公司,13,深圳市腾讯计算机系统有限公司,深圳市腾讯计算机系统有限公司,6,深圳,深圳,100
319733,300133.SZ,华策影视,深圳广播电影电视集团,深圳广播电影电视集团,14,深圳广播电影电视集团,深圳广播电影电视集团,7,深圳,深圳,100
319746,300133.SZ,华策影视,湖南广播电视台,湖南广播电视台,15,湖南广播电视台,湖南广播电视台,8,湖南,湖南,100
319747,300133.SZ,华策影视,湖南广播电视台,湖南广播电视台,15,湖南广播电视台卫视频道,湖南广播电视台卫视频道,9,湖南,湖南,100
319758,300133.SZ,华策影视,湖南广播电视台卫视频道,湖南广播电视台卫视频道,16,湖南广播电视台,湖南广播电视台,8,湖南,湖南,100
319759,300133.SZ,华策影视,湖南广播电视台卫视频道,湖南广播电视台卫视频道,16,湖南广播电视台卫视频道,湖南广播电视台卫视频道,9,湖南,湖南,100
319770,300133.SZ,华策影视,湖南广播电视台节目交易管理中心,湖南广播电视台节目交易管理中心,17,湖南广播电视台,湖南广播电视台,8,湖南,湖南,100
319784,300133.SZ,华策影视,湖南快乐阳光互动娱乐传媒有限公司,湖南快乐阳光互动娱乐传媒有限公司,18,湖南快乐阳光互动娱乐传媒有限公司,湖南快乐阳光互动娱乐传媒有限公司,10,湖南,湖南,100
319870,300133.SZ,华策影视,飞狐信息技术(天津)有限公司,飞狐信息技术(天津)有限公司,25,飞狐信息技术(天津)有限公司,飞狐信息技术(天津)有限公司,12,天津,天津,100
320017,300137.SZ,先河环保,河北省环境监测中心站,河北省环境监测中心站,30,河北省环境监测中心站,河北省环境监测中心站,2,河北,河北,100
320022,300137.SZ,先河环保,河北省环境监测站,河北省环境监测站,31,河北省环境监测中心站,河北省环境监测中心站,2,河北,河北,88
320048,300137.SZ,先河环保,深圳市环境监测中心站,深圳市环境监测中心站,36,深圳环境监测站,深圳环境监测站,3,深圳,深圳,86
320074,300137.SZ,先河环保,石家庄市环境监测站,石家庄市环境监测站,41,石家庄市环境监测中心,石家庄市环境监测中心,4,石家庄,石家庄,89
320321,300140.SZ,节能环境,国网四川省电力公司,国网四川省电力公司,12,国网四川省电力公司,国网四川省电力公司,1,四川,四川,100
320332,300140.SZ,节能环境,国网安徽省电力有限公司,国网安徽省电力有限公司,14,国网安徽省电力有限公司,国网安徽省电力有限公司,2,安徽,安徽,100
320338,300140.SZ,节能环境,国网山东省电力公司临沂供电公司,国网山东省电力公司临沂供电公司,15,国网山东省电力公司临沂供电公司,国网山东省电力公司临沂供电公司,3,山东,山东,100
