,wind_code,sec_name,ar_by_buyer_name,ar_buyer_standard,ar_buyer_subid,cus_name,cus_name_standard,cus_name_subid,ar_buyer_region,cus_region,match_score
507012,301315.SZ,威士顿,上海浦东发展银行股份有限公司,上海浦东发展银行股份有限公司,1,上海浦东发展银行股份有限公司,上海浦东发展银行股份有限公司,1,上海,上海,100
507029,301315.SZ,威士顿,上海烟草集团有限责任公司,上海烟草集团有限责任公司,2,上海烟草集团有限责任公司,上海烟草集团有限责任公司,4,上海,上海,100
507030,301315.SZ,威士顿,上海烟草集团有限责任公司,上海烟草集团有限责任公司,2,上海烟草集团有限责任公司天津卷烟厂,上海烟草集团有限责任公司天津卷烟厂,5,上海,上海,100
507094,301315.SZ,威士顿,江苏中烟工业有限责任公司,江苏中烟工业有限责任公司,6,江苏中烟工业有限责任公司,江苏中烟工业有限责任公司,13,江苏,江苏,100
507109,301315.SZ,威士顿,湖北中烟工业有限责任公司,湖北中烟工业有限责任公司,7,湖北中烟工业有限责任公司,湖北中烟工业有限责任公司,14,湖北,湖北,100
507166,301316.SZ,慧博云通,北京三星通信技术研究有限公司,北京三星通信技术研究有限公司,3,北京三星通信技术研究有限公司,北京三星通信技术研究有限公司,11,北京,北京,100
507346,301317.SZ,鑫磊股份,山东宏万建筑工程有限公司,山东宏万建筑工程有限公司,5,山东宏万建筑工程有限公司,山东宏万建筑工程有限公司,11,山东,山东,100
507381,301317.SZ,鑫磊股份,山东绿安伟业节能科技有限公司,山东绿安伟业节能科技有限公司,7,山东绿安伟业节能科技有限公司,山东绿安伟业节能科技有限公司,12,山东,山东,100
507468,301317.SZ,鑫磊股份,浙江未来万家五金机电有限公司,浙江未来万家五金机电有限公司,12,浙江未来万家五金机电有限公司,浙江未来万家五金机电有限公司,14,浙江,浙江,100
507469,301317.SZ,鑫磊股份,浙江未来万家五金机电有限公司,浙江未来万家五金机电有限公司,12,浙江未来万家五金机电有限公司(浙江未来之星五金机电有限公司),浙江未来万家五金机电有限公司(浙江未来之星五金机电有限公司),15,浙江,浙江,100
507470,301317.SZ,鑫磊股份,浙江未来万家五金机电有限公司,浙江未来万家五金机电有限公司,12,浙江未来之星五金机电有限公司,浙江未来之星五金机电有限公司,16,浙江,浙江,86
507485,301317.SZ,鑫磊股份,浙江未来万家五金机电有限公司(浙江未来之星五金机电有限公司),浙江未来万家五金机电有限公司(浙江未来之星五金机电有限公司),13,浙江未来万家五金机电有限公司,浙江未来万家五金机电有限公司,14,浙江,浙江,100
507486,301317.SZ,鑫磊股份,浙江未来万家五金机电有限公司(浙江未来之星五金机电有限公司),浙江未来万家五金机电有限公司(浙江未来之星五金机电有限公司),13,浙江未来万家五金机电有限公司(浙江未来之星五金机电有限公司),浙江未来万家五金机电有限公司(浙江未来之星五金机电有限公司),15,浙江,浙江,100
507487,301317.SZ,鑫磊股份,浙江未来万家五金机电有限公司(浙江未来之星五金机电有限公司),浙江未来万家五金机电有限公司(浙江未来之星五金机电有限公司),13,浙江未来之星五金机电有限公司,浙江未来之星五金机电有限公司,16,浙江,浙江,100
507502,301317.SZ,鑫磊股份,浙江未来之星五金机电有限公司,浙江未来之星五金机电有限公司,14,浙江未来万家五金机电有限公司,浙江未来万家五金机电有限公司,14,浙江,浙江,86
507503,301317.SZ,鑫磊股份,浙江未来之星五金机电有限公司,浙江未来之星五金机电有限公司,14,浙江未来万家五金机电有限公司(浙江未来之星五金机电有限公司),浙江未来万家五金机电有限公司(浙江未来之星五金机电有限公司),15,浙江,浙江,100
507504,301317.SZ,鑫磊股份,浙江未来之星五金机电有限公司,浙江未来之星五金机电有限公司,14,浙江未来之星五金机电有限公司,浙江未来之星五金机电有限公司,16,浙江,浙江,100
507818,301318.SZ,维海德,上海赛连信息科技有限公司,上海赛连信息科技有限公司,6,上海赛连信息科技有限公司,上海赛连信息科技有限公司,11,上海,上海,100
507842,301318.SZ,维海德,北京中庆现代技术股份有限公司,北京中庆现代技术股份有限公司,7,北京中庆现代技术股份有限公司,北京中庆现代技术股份有限公司,12,北京,北京,100
507890,301318.SZ,维海德,国科政信科技(北京)股份有限公司,国科政信科技(北京)股份有限公司,9,国科政信科技(北京)股份有限公司,国科政信科技(北京)股份有限公司,14,北京,北京,100
507916,301318.SZ,维海德,广州视睿电子科技有限公司,广州视睿电子科技有限公司,10,广州视睿电子科技有限公司,广州视睿电子科技有限公司,17,广州,广州,100
508134,301320.SZ,豪江智能,厦门中键贸易有限公司/革新(厦门)运动器材有限公司,厦门中键贸易有限公司/革新(厦门)运动器材有限公司,4,革新(厦门)运动器材有限公司,革新(厦门)运动器材有限公司,11,厦门,厦门,100
508163,301320.SZ,豪江智能,杭州顿力医疗器械有限公司/顿力集团有限公司余杭分公司,杭州顿力医疗器械有限公司/顿力集团有限公司余杭分公司,7,杭州顿力医疗器械有限公司/顿力集团有限公司,杭州顿力医疗器械有限公司/顿力集团有限公司,7,杭州,杭州,100
508177,301320.SZ,豪江智能,江苏里高智能家居有限公司,江苏里高智能家居有限公司,8,江苏里高智能家居有限公司,江苏里高智能家居有限公司,10,江苏,江苏,100
508446,301321.SZ,翰博高新,武汉华星光电技术有限公司,武汉华星光电技术有限公司,10,武汉华星光电技术有限公司,武汉华星光电技术有限公司,15,武汉,武汉,100
508977,301322.SZ,绿通科技,成都绿欣电动车有限公司,成都绿欣电动车有限公司,15,成都绿欣,成都绿欣,20,成都,成都,100
508978,301322.SZ,绿通科技,成都绿欣电动车有限公司,成都绿欣电动车有限公司,15,成都绿欣电动车有限公司,成都绿欣电动车有限公司,21,成都,成都,100
509090,301323.SZ,新莱福,上海丽川数码喷绘器材有限公司,上海丽川数码喷绘器材有限公司,7,上海丽川数码喷绘器材有限公司,上海丽川数码喷绘器材有限公司,11,上海,上海,100
509117,301325.SZ,曼恩斯特,宁德新能源科技有限公司,宁德新能源科技有限公司,1,宁德新能源科技有限公司,宁德新能源科技有限公司,2,宁德,宁德,100
509133,301325.SZ,曼恩斯特,宁德时代新能源科技股份有限公司,宁德时代新能源科技股份有限公司,2,宁德时代新能源科技股份有限公司,宁德时代新能源科技股份有限公司,3,宁德,宁德,100
509149,301325.SZ,曼恩斯特,安脉时代智能制造(宁德)有限公司,安脉时代智能制造(宁德)有限公司,3,安脉时代智能制造(宁德)有限公司,安脉时代智能制造(宁德)有限公司,4,宁德,宁德,100
509165,301325.SZ,曼恩斯特,惠州市赢合科技有限公司,惠州市赢合科技有限公司,4,惠州市赢合科技有限公司,惠州市赢合科技有限公司,5,惠州,惠州,100
509214,301325.SZ,曼恩斯特,深圳市新嘉拓自动化技术有限公司,深圳市新嘉拓自动化技术有限公司,7,深圳市新嘉拓自动化技术有限公司,深圳市新嘉拓自动化技术有限公司,9,深圳,深圳,100
509262,301325.SZ,曼恩斯特,绍兴弗迪电池有限公司,绍兴弗迪电池有限公司,10,绍兴弗迪电池有限公司,绍兴弗迪电池有限公司,12,绍兴,绍兴,100
509281,301326.SZ,捷邦科技,上海向隆电子科技有限公司,上海向隆电子科技有限公司,1,上海向隆电子科技有限公司,上海向隆电子科技有限公司,1,上海,上海,100
509799,301327.SZ,华宝新能,北京京东世纪贸易有限公司,北京京东世纪贸易有限公司,18,北京京东世纪贸易有限公司,北京京东世纪贸易有限公司,21,北京,北京,100
510008,301329.SZ,信音电子,英业达(重庆)有限公司,英业达(重庆)有限公司,11,英业达(重庆)有限公司,英业达(重庆)有限公司,14,重庆,重庆,100
510049,301329.SZ,信音电子,达丰(重庆)电脑有限公司,达丰(重庆)电脑有限公司,13,达丰(重庆)电脑有限公司,达丰(重庆)电脑有限公司,17,重庆,重庆,100
510254,301330.SZ,熵基科技,广州腾讯科技有限公司,广州腾讯科技有限公司,11,广州腾讯科技有限公司,广州腾讯科技有限公司,14,广州,广州,100
510284,301331.SZ,恩威医药,云南省久泰药业有限公司,云南省久泰药业有限公司,2,云南省久泰药业有限公司,云南省久泰药业有限公司,2,云南,云南,100
510391,301333.SZ,诺思格,上海君实生物医药科技股份有限公司,上海君实生物医药科技股份有限公司,3,上海君实生物医药科技股份有限公司,上海君实生物医药科技股份有限公司,3,上海,上海,100
510466,301333.SZ,诺思格,山东罗欣药业集团股份有限公司,山东罗欣药业集团股份有限公司,7,山东罗欣药业集团股份有限公司,山东罗欣药业集团股份有限公司,10,山东,山东,100
510616,301336.SZ,趣睡科技,北京三大于三咨询服务有限公司,北京三大于三咨询服务有限公司,1,北京三大于三咨询服务有限公司,北京三大于三咨询服务有限公司,2,北京,北京,100
510639,301336.SZ,趣睡科技,宁波天久进出口有限公司,宁波天久进出口有限公司,3,宁波天久进出口有限公司,宁波天久进出口有限公司,5,宁波,宁波,100
510711,301337.SZ,亚华电子,四川港通医疗设备集团股份有限公司,四川港通医疗设备集团股份有限公司,2,四川港通医疗设备集团股份有限公司,四川港通医疗设备集团股份有限公司,6,四川,四川,100
510755,301337.SZ,亚华电子,成都联帮医疗科技股份有限公司,成都联帮医疗科技股份有限公司,4,成都联帮医疗科技股份有限公司,成都联帮医疗科技股份有限公司,8,成都,成都,100
510776,301337.SZ,亚华电子,成都联帮医疗科技股份有限公司(成都联帮氧气工程有限公司),成都联帮医疗科技股份有限公司(成都联帮氧气工程有限公司),5,成都联帮医疗科技股份有限公司,成都联帮医疗科技股份有限公司,8,成都,成都,100
510799,301337.SZ,亚华电子,武汉市力齐电子有限公司,武汉市力齐电子有限公司,6,武汉市力齐电子有限公司,武汉市力齐电子有限公司,10,武汉,武汉,100
510866,301337.SZ,亚华电子,河南省人民医院,河南省人民医院,9,河南省人民医院,河南省人民医院,14,河南,河南,100
510888,301337.SZ,亚华电子,济南乐阁行商贸有限公司,济南乐阁行商贸有限公司,10,济南乐阁行商贸有限公司,济南乐阁行商贸有限公司,15,济南,济南,100
510932,301337.SZ,亚华电子,浙江强盛医用工程有限公司,浙江强盛医用工程有限公司,12,浙江强盛医用工程有限公司,浙江强盛医用工程有限公司,17,浙江,浙江,100
510977,301337.SZ,亚华电子,珠海和佳医疗设备股份有限公司,珠海和佳医疗设备股份有限公司,14,珠海和佳医疗设备股份有限公司,珠海和佳医疗设备股份有限公司,20,珠海,珠海,100
511216,301338.SZ,凯格精机,深圳市新光台电子科技有限公司,深圳市新光台电子科技有限公司,10,深圳市新光台电子科技股份有限公司,深圳市新光台电子科技股份有限公司,16,深圳,深圳,86
511236,301338.SZ,凯格精机,深圳新光台电子科技有限公司,深圳新光台电子科技有限公司,11,深圳市新光台电子科技股份有限公司,深圳市新光台电子科技股份有限公司,16,深圳,深圳,85
511278,301338.SZ,凯格精机,辽宁艾德光电科技有限公司,辽宁艾德光电科技有限公司,13,辽宁艾德光电科技有限公司,辽宁艾德光电科技有限公司,18,辽宁,辽宁,100
511356,301339.SZ,通行宝,江苏省农村信用社联合社,江苏省农村信用社联合社,7,江苏省农村信用社联合社,江苏省农村信用社联合社,8,江苏,江苏,100
511563,301348.SZ,蓝箭电子,上海晶丰明源半导体股份有限公司,上海晶丰明源半导体股份有限公司,1,上海晶丰明源半导体股份有限公司,上海晶丰明源半导体股份有限公司,3,上海,上海,100
511604,301348.SZ,蓝箭电子,广州盛中电子有限公司,广州盛中电子有限公司,4,广州盛中电子有限公司,广州盛中电子有限公司,5,广州,广州,100
511701,301349.SZ,信德新材,江西紫宸,江西紫宸,3,江西紫宸,江西紫宸,6,江西,江西,100
511799,301355.SZ,南王科技,东莞市以纯集团有限公司,东莞市以纯集团有限公司,1,东莞市以纯集团有限公司,东莞市以纯集团有限公司,5,东莞,东莞,100
511865,301355.SZ,南王科技,必胜(上海)食品有限公司,必胜(上海)食品有限公司,4,必胜(上海)食品有限公司,必胜(上海)食品有限公司,8,上海,上海,100
512001,301355.SZ,南王科技,福建袋王包装有限公司,福建袋王包装有限公司,10,福建袋王包装有限公司,福建袋王包装有限公司,18,福建,福建,100
512022,301355.SZ,南王科技,福建袋王包装有限公司-三福,福建袋王包装有限公司-三福,11,福建袋王包装有限公司,福建袋王包装有限公司,18,福建,福建,100
512168,301358.SZ,湖南裕能,四川时代新能源科技有限公司,四川时代新能源科技有限公司,1,四川时代新能源科技有限公司,四川时代新能源科技有限公司,1,四川,四川,100
512179,301358.SZ,湖南裕能,宁德时代公司,宁德时代公司,2,宁德时代公司,宁德时代公司,2,宁德,宁德,100
512211,301358.SZ,湖南裕能,杭州南都动力科技有限公司,杭州南都动力科技有限公司,5,杭州南都动力科技有限公司,杭州南都动力科技有限公司,4,杭州,杭州,100
512222,301358.SZ,湖南裕能,江苏时代公司,江苏时代公司,6,江苏时代公司,江苏时代公司,5,江苏,江苏,100
512235,301358.SZ,湖南裕能,深圳比亚迪公司,深圳比亚迪公司,7,深圳比亚迪公司,深圳比亚迪公司,8,深圳,深圳,100
512246,301358.SZ,湖南裕能,湖南三迅新能源科技有限公司,湖南三迅新能源科技有限公司,8,湖南三迅新能源科技有限公司,湖南三迅新能源科技有限公司,9,湖南,湖南,100
512267,301358.SZ,湖南裕能,路华能源科技(保山)有限公司,路华能源科技(保山)有限公司,10,路华能源科技(保山)有限公司,路华能源科技(保山)有限公司,10,保山,保山,100
512313,301359.SZ,东南电子,中山东菱威力电器有限公司,中山东菱威力电器有限公司,3,中山东菱威力电器有限公司,中山东菱威力电器有限公司,8,山东,山东,100
512333,301359.SZ,东南电子,佛山市顺德区美的洗涤电器制造有限公司,佛山市顺德区美的洗涤电器制造有限公司,4,佛山市顺德区美的洗涤电器制造有限公司,佛山市顺德区美的洗涤电器制造有限公司,9,佛山,佛山,100
512353,301359.SZ,东南电子,厦门耀盈机电设备有限公司,厦门耀盈机电设备有限公司,5,厦门耀盈机电设备有限公司,厦门耀盈机电设备有限公司,10,厦门,厦门,100
512373,301359.SZ,东南电子,广东美的厨房电器制造有限公司,广东美的厨房电器制造有限公司,6,广东美的厨房电器制造有限公司,广东美的厨房电器制造有限公司,11,广东,广东,100
512432,301359.SZ,东南电子,深圳市东南伟业电子有限公司,深圳市东南伟业电子有限公司,9,深圳市东南伟业电子有限公司,深圳市东南伟业电子有限公司,13,深圳,深圳,100
512494,301359.SZ,东南电子,苏州工业园区思威电子有限公司,苏州工业园区思威电子有限公司,12,苏州工业园区思威电子有限公司,苏州工业园区思威电子有限公司,18,苏州,苏州,100
512554,301360.SZ,荣旗科技,杭州智见科技有限公司,杭州智见科技有限公司,7,杭州智见科技有限公司,杭州智见科技有限公司,5,杭州,杭州,100
512706,301361.SZ,众智科技,山东华力机电有限公司,山东华力机电有限公司,7,山东华力机电有限公司,山东华力机电有限公司,7,山东,山东,100
512723,301361.SZ,众智科技,山东赛马力发电设备有限公司,山东赛马力发电设备有限公司,8,山东赛马力发电设备有限公司,山东赛马力发电设备有限公司,8,山东,山东,100
512756,301361.SZ,众智科技,扬州市孚创控制设备厂,扬州市孚创控制设备厂,10,扬州市孚创控制设备厂,扬州市孚创控制设备厂,9,扬州,扬州,100
512824,301361.SZ,众智科技,福建一华电机有限公司,福建一华电机有限公司,14,福建一华电机有限公司,福建一华电机有限公司,13,福建,福建,100
512841,301361.SZ,众智科技,郑州佛光发电设备有限公司,郑州佛光发电设备有限公司,15,郑州佛光发电设备有限公司,郑州佛光发电设备有限公司,14,郑州,郑州,100
513100,301363.SZ,美好医疗,深圳迈瑞生物医疗电子股份有限公司,深圳迈瑞生物医疗电子股份有限公司,6,深圳迈瑞生物医疗电子股份有限公司,深圳迈瑞生物医疗电子股份有限公司,4,深圳,深圳,100
513110,301363.SZ,美好医疗,深圳长城开发科技股份有限公司[注6],深圳长城开发科技股份有限公司[注6],7,深圳长城开发科技股份有限公司,深圳长城开发科技股份有限公司,5,深圳,深圳,100
513616,301366.SZ,一博科技,深圳市好克医疗仪器股份有限公司,深圳市好克医疗仪器股份有限公司,10,深圳市好克医疗仪器股份有限公司,深圳市好克医疗仪器股份有限公司,7,深圳,深圳,100
513653,301366.SZ,一博科技,湖南中联重科智能技术有限公司,湖南中联重科智能技术有限公司,13,湖南中联重科智能技术有限公司,湖南中联重科智能技术有限公司,8,湖南,湖南,100
513669,301366.SZ,一博科技,郑州煤机液压电控有限公司,郑州煤机液压电控有限公司,14,郑州煤机液压电控有限公司,郑州煤机液压电控有限公司,12,郑州,郑州,100
514094,301368.SZ,丰立智能,湖南麒麟创新科技有限公司,湖南麒麟创新科技有限公司,10,湖南麒麟创新科技有限公司,湖南麒麟创新科技有限公司,5,湖南,湖南,100
514110,301368.SZ,丰立智能,苏州锐研汽保设备有限公司,苏州锐研汽保设备有限公司,12,苏州锐研汽保设备有限公司,苏州锐研汽保设备有限公司,7,苏州,苏州,100
514410,301371.SZ,敷尔佳,北京京东弘健健康有限公司,北京京东弘健健康有限公司,3,北京京东弘健健康有限公司,北京京东弘健健康有限公司,4,北京,北京,100
514660,301372.SZ,科净源,中和利华投资管理(北京)有限公司,中和利华投资管理(北京)有限公司,1,中和利华投资管理(北京)有限公司,中和利华投资管理(北京)有限公司,2,北京,北京,100
514689,301372.SZ,科净源,云南工程建设总承包股份有限公司,云南工程建设总承包股份有限公司,2,云南工程建设总承包股份有限公司,云南工程建设总承包股份有限公司,4,云南,云南,100
514746,301372.SZ,科净源,北京北排建设有限公司,北京北排建设有限公司,4,北京北排建设有限公司,北京北排建设有限公司,7,北京,北京,100
514926,301372.SZ,科净源,青岛瑞源工程集团有限公司云南分公司,青岛瑞源工程集团有限公司云南分公司,10,青岛瑞源工程集团有限公司云南分公司,青岛瑞源工程集团有限公司云南分公司,25,云南,云南,100
514937,301373.SZ,凌玮科技,广东华润涂料有限公司,广东华润涂料有限公司,1,广东华润涂料有限公司,广东华润涂料有限公司,9,广东,广东,100
514956,301373.SZ,凌玮科技,广东阿博特数码纸业有限公司,广东阿博特数码纸业有限公司,2,广东阿博特数码纸业有限公司,广东阿博特数码纸业有限公司,10,广东,广东,100
514995,301373.SZ,凌玮科技,江苏奥力广告材料股份有限公司,江苏奥力广告材料股份有限公司,4,江苏奥力广告材料股份有限公司,江苏奥力广告材料股份有限公司,13,江苏,江苏,100
515013,301373.SZ,凌玮科技,江苏奥力新材料股份有限公司,江苏奥力新材料股份有限公司,5,江苏奥力广告材料股份有限公司,江苏奥力广告材料股份有限公司,13,江苏,江苏,85
515108,301373.SZ,凌玮科技,青岛佳艺影像新材料技术有限公司,青岛佳艺影像新材料技术有限公司,10,青岛佳艺影像新材料技术有限公司,青岛佳艺影像新材料技术有限公司,18,青岛,青岛,100
515127,301377.SZ,鼎泰高科,东莞美维电路有限公司及同一控制下公司,东莞美维电路有限公司及同一控制下公司,1,东莞美维电路有限公司,东莞美维电路有限公司,1,东莞,东莞,100
515138,301377.SZ,鼎泰高科,健鼎(无锡)电子有限公司及同一控制下公司,健鼎(无锡)电子有限公司及同一控制下公司,2,健鼎(无锡)电子有限公司,健鼎(无锡)电子有限公司,2,无锡,无锡,100
515149,301377.SZ,鼎泰高科,华通电脑(惠州)有限公司及同一控制下公司,华通电脑(惠州)有限公司及同一控制下公司,3,华通电脑(惠州)有限公司,华通电脑(惠州)有限公司,3,惠州,惠州,100
515205,301377.SZ,鼎泰高科,红板(江西)有限公司及同一控制下公司,红板(江西)有限公司及同一控制下公司,8,红板(江西)有限公司,红板(江西)有限公司,9,江西,江西,100
515216,301377.SZ,鼎泰高科,胜宏科技(惠州)股份有限公司及同一控制下公司,胜宏科技(惠州)股份有限公司及同一控制下公司,9,胜宏科技(惠州)股份有限公司,胜宏科技(惠州)股份有限公司,10,惠州,惠州,100
515221,301378.SZ,通达海,北京华宇信息技术有限公司,北京华宇信息技术有限公司,1,北京华宇信息技术有限公司,北京华宇信息技术有限公司,5,北京,北京,100
515240,301378.SZ,通达海,安徽省高级人民法院,安徽省高级人民法院,2,安徽省高级人民法院,安徽省高级人民法院,8,安徽,安徽,100
515273,301378.SZ,通达海,广东省广州市中级人民法院,广东省广州市中级人民法院,4,广东省广州市中级人民法院,广东省广州市中级人民法院,9,广东,广东,100
515340,301378.SZ,通达海,江苏省高级人民法院,江苏省高级人民法院,8,江苏省高级人民法院,江苏省高级人民法院,12,江苏,江苏,100
515491,301379.SZ,天山电子,北京京东方光电科技有限公司,北京京东方光电科技有限公司,3,北京京东方光电科技有限公司,北京京东方光电科技有限公司,5,北京,北京,100
515524,301379.SZ,天山电子,杭州海康威视科技有限公司,杭州海康威视科技有限公司,5,杭州海康威视科技有限公司及其受同一控制人控制的其他主体,杭州海康威视科技有限公司及其受同一控制人控制的其他主体,8,杭州,杭州,100
515540,301379.SZ,天山电子,江西亿明电子有限公司,江西亿明电子有限公司,6,江西亿明电子有限公司,江西亿明电子有限公司,9,江西,江西,100
515541,301379.SZ,天山电子,江西亿明电子有限公司,江西亿明电子有限公司,6,江西亿明电子有限公司及其受同一控制人控制的其他主体,江西亿明电子有限公司及其受同一控制人控制的其他主体,10,江西,江西,100
515574,301379.SZ,天山电子,百富计算机技术(深圳)有限公司,百富计算机技术(深圳)有限公司,8,百富计算机技术(深圳)有限公司,百富计算机技术(深圳)有限公司,13,深圳,深圳,100
515590,301379.SZ,天山电子,骏升科技(钦州)有限公司,骏升科技(钦州)有限公司,9,骏升科技(钦州)有限公司,骏升科技(钦州)有限公司,14,钦州,钦州,100
515591,301379.SZ,天山电子,骏升科技(钦州)有限公司,骏升科技(钦州)有限公司,9,骏升科技(钦州)有限公司及其受同一控制人控制的其他主体,骏升科技(钦州)有限公司及其受同一控制人控制的其他主体,15,钦州,钦州,100
515605,301379.SZ,天山电子,骏升科技(钦州)有限公司[注3],骏升科技(钦州)有限公司[注3],10,骏升科技(钦州)有限公司,骏升科技(钦州)有限公司,14,钦州,钦州,100
515607,301380.SZ,挖金客,上海优铭云计算有限公司,上海优铭云计算有限公司,1,上海优铭云计算有限公司,上海优铭云计算有限公司,1,上海,上海,100
515861,301380.SZ,挖金客,北京轩翔思悦传媒广告有限公司,北京轩翔思悦传媒广告有限公司,12,北京轩翔思悦传媒广告有限公司,北京轩翔思悦传媒广告有限公司,13,北京,北京,100
515974,301380.SZ,挖金客,广州美推网络科技有限公司,广州美推网络科技有限公司,17,广州美推网络科技有限公司,广州美推网络科技有限公司,16,广州,广州,100
516020,301380.SZ,挖金客,携程计算机技术(上海)有限公司,携程计算机技术(上海)有限公司,19,携程计算机技术(上海)有限公司,携程计算机技术(上海)有限公司,18,上海,上海,100
